{
  "mode": "historical-sample",
  "complete": false,
  "currentMetricsVerified": false,
  "analysis": {
    "startYear": 1880,
    "endYear": 2009,
    "unit": "sum-of-published-SSA-name-counts"
  },
  "source": {
    "publisher": "hadley/babynames",
    "url": "https://raw.githubusercontent.com/hadley/babynames/4391c25ea10b8b0589cdbab63067de3bc8b3a628/data/babynames.rda",
    "commit": "4391c25ea10b8b0589cdbab63067de3bc8b3a628",
    "sha256": "1d5c601fa3c5177f4d9edb4c8c2f08fddc8d9bf04372b8a40dc6aecf92bfa324",
    "license": "CC0",
    "coverageStartYear": 1880,
    "coverageEndYear": 2017
  },
  "rows": [
    {
      "id": "ssa:M:Thomas",
      "name": "Thomas",
      "sex": "M",
      "totalPublishedCount": 2248621,
      "peakDecade": 1950,
      "peakCount": 454195,
      "runnerUpCount": 350739,
      "sparkline": [
        {
          "decade": 1880,
          "count": 23750,
          "publishedYearCount": 10,
          "omittedYearCount": 0
        },
        {
          "decade": 1890,
          "count": 21115,
          "publishedYearCount": 10,
          "omittedYearCount": 0
        },
        {
          "decade": 1900,
          "count": 21785,
          "publishedYearCount": 10,
          "omittedYearCount": 0
        },
        {
          "decade": 1910,
          "count": 91619,
          "publishedYearCount": 10,
          "omittedYearCount": 0
        },
        {
          "decade": 1920,
          "count": 161111,
          "publishedYearCount": 10,
          "omittedYearCount": 0
        },
        {
          "decade": 1930,
          "count": 183855,
          "publishedYearCount": 10,
          "omittedYearCount": 0
        },
        {
          "decade": 1940,
          "count": 350739,
          "publishedYearCount": 10,
          "omittedYearCount": 0
        },
        {
          "decade": 1950,
          "count": 454195,
          "publishedYearCount": 10,
          "omittedYearCount": 0
        },
        {
          "decade": 1960,
          "count": 327158,
          "publishedYearCount": 10,
          "omittedYearCount": 0
        },
        {
          "decade": 1970,
          "count": 186880,
          "publishedYearCount": 10,
          "omittedYearCount": 0
        },
        {
          "decade": 1980,
          "count": 177781,
          "publishedYearCount": 10,
          "omittedYearCount": 0
        },
        {
          "decade": 1990,
          "count": 146581,
          "publishedYearCount": 10,
          "omittedYearCount": 0
        },
        {
          "decade": 2000,
          "count": 102052,
          "publishedYearCount": 10,
          "omittedYearCount": 0
        }
      ],
      "fact": null,
      "factStatus": "unverified",
      "recognitionVerified": false
    },
    {
      "id": "ssa:M:Christopher",
      "name": "Christopher",
      "sex": "M",
      "totalPublishedCount": 1934692,
      "peakDecade": 1980,
      "peakCount": 554859,
      "runnerUpCount": 475614,
      "sparkline": [
        {
          "decade": 1880,
          "count": 752,
          "publishedYearCount": 10,
          "omittedYearCount": 0
        },
        {
          "decade": 1890,
          "count": 668,
          "publishedYearCount": 10,
          "omittedYearCount": 0
        },
        {
          "decade": 1900,
          "count": 484,
          "publishedYearCount": 10,
          "omittedYearCount": 0
        },
        {
          "decade": 1910,
          "count": 1961,
          "publishedYearCount": 10,
          "omittedYearCount": 0
        },
        {
          "decade": 1920,
          "count": 2865,
          "publishedYearCount": 10,
          "omittedYearCount": 0
        },
        {
          "decade": 1930,
          "count": 2734,
          "publishedYearCount": 10,
          "omittedYearCount": 0
        },
        {
          "decade": 1940,
          "count": 15871,
          "publishedYearCount": 10,
          "omittedYearCount": 0
        },
        {
          "decade": 1950,
          "count": 78228,
          "publishedYearCount": 10,
          "omittedYearCount": 0
        },
        {
          "decade": 1960,
          "count": 237203,
          "publishedYearCount": 10,
          "omittedYearCount": 0
        },
        {
          "decade": 1970,
          "count": 475614,
          "publishedYearCount": 10,
          "omittedYearCount": 0
        },
        {
          "decade": 1980,
          "count": 554859,
          "publishedYearCount": 10,
          "omittedYearCount": 0
        },
        {
          "decade": 1990,
          "count": 360204,
          "publishedYearCount": 10,
          "omittedYearCount": 0
        },
        {
          "decade": 2000,
          "count": 203249,
          "publishedYearCount": 10,
          "omittedYearCount": 0
        }
      ],
      "fact": null,
      "factStatus": "unverified",
      "recognitionVerified": false
    },
    {
      "id": "ssa:M:Daniel",
      "name": "Daniel",
      "sex": "M",
      "totalPublishedCount": 1795699,
      "peakDecade": 1980,
      "peakCount": 345478,
      "runnerUpCount": 272227,
      "sparkline": [
        {
          "decade": 1880,
          "count": 5680,
          "publishedYearCount": 10,
          "omittedYearCount": 0
        },
        {
          "decade": 1890,
          "count": 5185,
          "publishedYearCount": 10,
          "omittedYearCount": 0
        },
        {
          "decade": 1900,
          "count": 5036,
          "publishedYearCount": 10,
          "omittedYearCount": 0
        },
        {
          "decade": 1910,
          "count": 23980,
          "publishedYearCount": 10,
          "omittedYearCount": 0
        },
        {
          "decade": 1920,
          "count": 43421,
          "publishedYearCount": 10,
          "omittedYearCount": 0
        },
        {
          "decade": 1930,
          "count": 47990,
          "publishedYearCount": 10,
          "omittedYearCount": 0
        },
        {
          "decade": 1940,
          "count": 112756,
          "publishedYearCount": 10,
          "omittedYearCount": 0
        },
        {
          "decade": 1950,
          "count": 243613,
          "publishedYearCount": 10,
          "omittedYearCount": 0
        },
        {
          "decade": 1960,
          "count": 242092,
          "publishedYearCount": 10,
          "omittedYearCount": 0
        },
        {
          "decade": 1970,
          "count": 244557,
          "publishedYearCount": 10,
          "omittedYearCount": 0
        },
        {
          "decade": 1980,
          "count": 345478,
          "publishedYearCount": 10,
          "omittedYearCount": 0
        },
        {
          "decade": 1990,
          "count": 272227,
          "publishedYearCount": 10,
          "omittedYearCount": 0
        },
        {
          "decade": 2000,
          "count": 203684,
          "publishedYearCount": 10,
          "omittedYearCount": 0
        }
      ],
      "fact": null,
      "factStatus": "unverified",
      "recognitionVerified": false
    },
    {
      "id": "ssa:F:Elizabeth",
      "name": "Elizabeth",
      "sex": "F",
      "totalPublishedCount": 1552446,
      "peakDecade": 1980,
      "peakCount": 198965,
      "runnerUpCount": 172624,
      "sparkline": [
        {
          "decade": 1880,
          "count": 25006,
          "publishedYearCount": 10,
          "omittedYearCount": 0
        },
        {
          "decade": 1890,
          "count": 33879,
          "publishedYearCount": 10,
          "omittedYearCount": 0
        },
        {
          "decade": 1900,
          "count": 41708,
          "publishedYearCount": 10,
          "omittedYearCount": 0
        },
        {
          "decade": 1910,
          "count": 116811,
          "publishedYearCount": 10,
          "omittedYearCount": 0
        },
        {
          "decade": 1920,
          "count": 139674,
          "publishedYearCount": 10,
          "omittedYearCount": 0
        },
        {
          "decade": 1930,
          "count": 96470,
          "publishedYearCount": 10,
          "omittedYearCount": 0
        },
        {
          "decade": 1940,
          "count": 116535,
          "publishedYearCount": 10,
          "omittedYearCount": 0
        },
        {
          "decade": 1950,
          "count": 165646,
          "publishedYearCount": 10,
          "omittedYearCount": 0
        },
        {
          "decade": 1960,
          "count": 168895,
          "publishedYearCount": 10,
          "omittedYearCount": 0
        },
        {
          "decade": 1970,
          "count": 142858,
          "publishedYearCount": 10,
          "omittedYearCount": 0
        },
        {
          "decade": 1980,
          "count": 198965,
          "publishedYearCount": 10,
          "omittedYearCount": 0
        },
        {
          "decade": 1990,
          "count": 172624,
          "publishedYearCount": 10,
          "omittedYearCount": 0
        },
        {
          "decade": 2000,
          "count": 133375,
          "publishedYearCount": 10,
          "omittedYearCount": 0
        }
      ],
      "fact": null,
      "factStatus": "unverified",
      "recognitionVerified": false
    },
    {
      "id": "ssa:M:Matthew",
      "name": "Matthew",
      "sex": "M",
      "totalPublishedCount": 1485011,
      "peakDecade": 1980,
      "peakCount": 458955,
      "runnerUpCount": 351606,
      "sparkline": [
        {
          "decade": 1880,
          "count": 1068,
          "publishedYearCount": 10,
          "omittedYearCount": 0
        },
        {
          "decade": 1890,
          "count": 1132,
          "publishedYearCount": 10,
          "omittedYearCount": 0
        },
        {
          "decade": 1900,
          "count": 1189,
          "publishedYearCount": 10,
          "omittedYearCount": 0
        },
        {
          "decade": 1910,
          "count": 6228,